pub_date	title	venue	excerpt	citation	url_slug	paper_url
2022-01-01	Human intracranial recordings reveal distinct cortical activity patterns during invasive and non-invasive vagus nerve stimulation.	In Review	Tags: vagus nerve stimulation, neuromodulation, taVNS, ECoG	"Schuerman, W. L., Nourski, K. V., Rhone, A. E., Howard, M. A., Chang, E. F., & Leonard, M. K. (2021). ""Human intracranial recordings reveal distinct cortical activity patterns during invasive and non-invasive vagus nerve stimulation."" <i>In Review</i>."	paper-title-number-1	url
2021-09-07	Learning nonnative speech sounds changes local encoding in the adult human cortex.	Proceedings of the National Academy of Sciences	Tags: sound learning, ECoG	"Han, G. Y., Chandrasekaran, B., Nourski, K.V., Rhone, A.E., Schuerman, W. L., Howard, M. A., Chang, E. F., & Leonard, M. K. (2021). ""Learning nonnative speech sounds changes local encoding in the adult human cortex."" <i>Proceedings of the National Academy of Sciences</i>, 118(36)."	paper-title-number-2	url
2020-09-21	Using expletive insertion to pursue and sanction in interaction.	Journal of Sociolinguistics	Tags: taboo speech, conversation analysis	"Hoey, E. M., Hömke, P., Löfgren, E., Neumann, T., Schuerman, W. L., & Kendrick, K. H. (2020). ""Using expletive insertion to pursue and sanction in interaction."" <i>Journal of Sociolinguistics</i>. 25(1)."	paper-title-number-3	url
2020-08-06	Non-invasive peripheral nerve stimulation selectively enhances speech category learning in adults.	npj Science of Learning	Tags: sound learning, transcutaneous auricular vagus nerve stimulation (taVNS), EEG	"Llanos, F., McHaney, J. R., Schuerman, W. L., Yi, H. G., Leonard, M. K., & Chandrasekaran, B. (2020). ""Non-invasive peripheral nerve stimulation selectively enhances speech category learning in adults.""  <i>npj Science of Learning</i>, 5(1)"	paper-title-number-4	10.1038/s41539-020-0070-0.
2019-05-20	Comparison of Common Artifact Rejection Methods applied to Direct Cortical and Peripheral Stimulation in Human ECoG.	in 2019 9th International IEEE/EMBS Conference on Neural Engineering (NER)	Tags: cortical stimulation, peripheral stimulation, ECoG, methods	"Sellers, K.K., Schuerman, W.L., Dawes, H. E., Chang, E. F., & Leonard, M. K., (2019). ""Comparison of Common Artifact Rejection Methods applied to Direct Cortical and Peripheral Stimulation in Human ECoG."" In <i>2019 9th International IEEE/EMBS Conference on Neural Engineering (NER)</i>, Mar. 2019, pp. 77–80"	paper-title-number-5	10.1109/NER.2019.8716980
2017-04-17	Sensorimotor adaptation affects perceptual compensation for coarticulation.	Journal of the Acoustical Society of America	Tags: altered auditory feedback, compensation for coarticulation, sensorimotor processing, speech perception	"Schuerman, W. L., Nagarajan, S., McQueen, J. M., & Houde, J. (2017) ""Sensorimotor Adaptation Affects Perceptual Compensation for Coarticulation."" <i>The Journal of the Acoustical Society of America</i>, 141 (4), 2693-2704"	paper-title-number-6	url
2017-04-07	Mapping the Speech Code: Cortical Responses Linking the Perception and Production of Vowels.	Frontiers in Human Neuroscience	Tags: altered auditory feedback, speech perception, EEG	"Schuerman, W. L., Meyer, A., & McQueen, J. M. (2017). ""Mapping the Speech Code: Cortical responses linking the perception and production of vowels."" <i>Frontiers in Human Neuroscience</i>, 11(161)"	paper-title-number-7	url
2016-06-01	What sound symbolism can and cannot do: testing the iconicity of ideophones from five languages.	Language	Tags: phonetics, sound symbolism, psycholinguistics	"Dingemanse, M., Schuerman, W., Reinisch, E., Tufvesson, S., & Mitterer, H. (2016). ""What sound symbolism can and cannot do: testing the iconicity of ideophones from five languages."" <i>Language</i>, 92(2), e67-e83."	paper-title-number-8	url
2015-07-02	Do we perceive others better than ourselves? A perceptual benefit for noise-vocoded speech produced by an average speaker.	PLoS One	Tags: speech perception, phonetics, psycholinguistics	"Schuerman, W., Meyer, A. S., & McQueen, J. M. (2015). ""Do we perceive others better than ourselves? A perceptual benefit for noise-vocoded speech produced by an average speaker."" <i>PLoS One</i>, 10(7): e0129731"	paper-title-number-9	10.1371/journal.pone.0129731